id,term,definition
card1,Greatest technical autonomy professional relationship,Client-professional relationship gives an engineer or geoscientist the greatest technical autonomy.
card2,Administration of provincial Act creating engineering/geoscience association,The Association's Council (self-governing body) administers that Act.
card3,Core expectations of self-governing profession in Canada,(1) Legal and ethical responsibility for one's work (2) Public interest held paramount.
card4,Bribe for false testimony—what professional duty does this violate?,"It violates the Duty to the Profession: engineers/geoscientists must maintain dignity and avoid dishonourable conduct.

Simple Example:A contractor slips an engineer cash to lie in court about a bridge's safety. Accepting this bribe is dishonourable and breaks the engineer's duty to uphold the profession's integrity."
card5,Legal action for licensing engineers,Passage of provincial/territorial legislation that authorises the association.
card6,Best practice for land survey conflict,Decline the second contract without revealing the first client's interest.
card7,What process does the ethical-decision framework mirror and why?,"The design process. Both use a structured, step-by-step approach to solve problems logically."
card8,Employer statement when reassigning unsafe work,"Why, in the employer's opinion, the work no longer (or never did) pose a danger."
card9,Consultant-client contract role,As part of the client's team and acting in the client's best interests (after the public's).
card10,Billing fraudulently instruction,Refuse the instruction and tell the employer it is illegal.
card11,Core expectations of self-governing professions,"(1) Legal & ethical responsibility for work (2) Public interest held paramount.

Simplified Explanation:

The two main expectations of self-regulated professions are:

Professionals must take legal and ethical responsibility for the work they do.
They must put the public’s best interests first, above profit or personal gain.

This means these professions are trusted to act responsibly, honestly, and for the common good.

Example:

A doctor must follow medical laws and ethical rules when treating patients.
A lawyer must act honestly and follow professional standards.
Both should make decisions that protect the public, not just themselves.
For example, a doctor should prioritize patient safety over making more money.
That shows both accountability and commitment to the public interest."
card12,"Under an NDA, can you use technical know-how you gained on the project in future work?

(Technical know-how means Skills, methods, and practical knowledge you gain through work or training. And, 
NDA (Non-Disclosure Agreement) means A legal contract saying you must keep certain information secret.)","Yes—skills and knowledge become part of your experience, though facts under NDA stay confidential. Or in other words, Yes. You can use your general skills and experience, but you must not disclose or use the client’s confidential information (e.g., proprietary data, drawings, code, trade secrets)."
card13,OHS refusal-of-work notice requirements,The employer's rationale that the task is now safe.
card14,Provincial/territorial association support,Its own Code of Ethics.
card15,Golden Mean solution in virtue ethics,"A compromise size (e.g., 300 000 sq ft) balancing patient need and park land."
card16,Golden Rule and ethical theories,"The Golden Rule , which says ""treat others how you want to be treated"" fits into all four major ethical theories.

Kant would say it’s your duty.

Mill would like it because it leads to good outcomes for many.

Locke would support it because it respects others’ rights.

Aristotle would call it a sign of good character.
So, it’s a rule that almost every moral system agrees with."
card17,Code-of-Ethics line on conflicts of interest,"Act as faithful agents, maintain confidentiality, avoid or fully disclose conflicts without delay."
card18,Potential conflict-of-interest example,"A ""dry"" town accepts soft-drink billboard money from a brewer that may advertise beer later."
card19,Employer requirements under confidentiality law,A written statement of why the employer believes the work is now safe (or never was unsafe).
card20,Paternalism in international consulting,Definition not provided.
card21,Paramount obligation (the top duty in the Code of Ethics),"In every Canadian engineering/geoscience Code of Ethics, the paramount obligation is to protect public welfare and the environment."
card22,Categories of justice,"The four fundamental categories of justice used in ethics are Procedural, Corrective (or Retributive), Distributive, Political."
card23,Traditional branches of philosophy,"Anthropology is not a traditional branch of philosophy; traditional branches include logic, metaphysics, epistemology, axiology."
card24,What is extortion in a professional context?,Extortion is a coerced demand by someone in authority for payment or a benefit to give a routine approval or service that should be free.
card25,First ethical step for management request,The first ethical step if management asks you to downgrade a design below code to save money is to explain the consequences in writing and ensure management understands the risk; do not seal an unsafe design.
card26,Fraudulent registration,Falsifying experience on a P.Eng. application is called this under the Act.
card27,Non-disclosure (confidentiality) clause,Best protects an employer's trade secrets if an employee later leaves.
card28,"Canadian product-liability ""duty-of-care"" precedent case","Donoghue v. Stevenson - manufacturer owes reasonable care to end-user.

In Donoghue v. Stevenson, the court said that manufacturers must take reasonable care to make sure their products are safe for the people who use them.
This case created the rule that you can be held responsible if someone is hurt because you didn’t make your product safely—even if they didn’t buy it directly from you.

Example

A woman found a snail in her ginger beer and got sick.
She didn’t buy the drink herself, but the manufacturer was still held responsible.
Why? Because they had a duty of care to anyone who might drink their product.
This case showed that companies can’t ignore the end-user’s safety.
It helped shape the modern idea of negligence law."
card29,First screening question in engineering ethical dilemma,"""Does this situation endanger public health or safety?"" - if yes, act immediately (up to whistle-blowing)."
card30,Are electronic records less reliable than paper records for evidence?,"No. Form/media doesn’t matter. Records are reliable if you can prove integrity, completeness, and authenticity. Electronic and hard-copy are equally acceptable. "
card31,Peer review of another engineer's work,No permission required; courtesy notification is enough; employer/client can mandate the review.
card32,"Engineer used a widely-criticised, unrevised tech-society code and structure failed - likely court view?","Engineer liable - ought to have known the code was inadequate given recent, public failures."
card33,"Experience-report competency category for writing specs, reports, procedures",Communication skills competency.
card34,No applicable codes for a cutting-edge design—engineer's path forward,Proceed using sound engineering principles and the Code of Ethics; document rationale and prioritize public safety.
card35,"ISO standards: after final approval, what can member countries do?",Choose to adopt and publish the ISO as their own national standard (adoption is voluntary).
card36,"Protecting oneself when proposing an unusual, higher-risk design approach",Fully disclose the risks to the client and obtain informed acceptance; risk then shifts to the informed client.
card37,What is material non-disclosure in professional liability insurance?,"Failing to reveal relevant information (e.g., a prior negligence claim) when purchasing Errors & Omissions (E&O) coverage. Such nondisclosure is ""material"" because it influences the insurer's decision—omitting it can void the policy."
card38,Retention period for authenticated drawings,"Keep them for as long as liability exists (e.g., 10 yrs BC, 12 yrs AB) as a due-diligence defence."
card39,Improving communication skills after email mishap,Clarity and completeness in digital instructions.
card40,Lacking expertise on Indigenous-rights impacts in an EA,Continue only by engaging a specialist with that expertise (Engineers Canada SD Guideline §4).
card41,Environmental costs in economic viability studies,Environmental protection is an integral part of project planning; associated costs must be included (APEGA Env. Guideline §3.5).
card42,What does the Engineers Canada Code of Ethics “mentoring clause” require supervisors to provide?,Opportunities for the professional development of the people they supervise.
card43,Code-of-Ethics: three permissible responses to employer actions risking public welfare,(1) Correct the problem (2) Whistle-blow (3) Resign in protest.
card44,What is the collegial (Theory Y) management style?,"Staff are trusted to work independently within agreed guidelines; the manager treats them as peers rather than micromanaging them.
Collegial (adj): cooperative, treating colleagues as equals."
card45,2015 UN climate accord that caps global warming - what is it called?,"Paris Agreement• Adopted under the UNFCCC in December 2015 to limit warming to well below 2 °C above pre-industrial levels, aiming for 1.5 °C.
Accord (noun): a formal agreement between parties."
card46,"Single best defence against a negligence lawsuit.
(A negligence lawsuit is when someone takes another person to court because they got hurt or suffered damage due to the other person not being careful enough. Imagine a grocery store didn’t clean up a spill for hours.
You walk in, slip on it, and break your arm.
The store was supposed to keep the floors safe and clean.
Since they didn’t, that’s called negligence.
You could file a lawsuit asking for money to cover your medical bills.
That’s a negligence lawsuit.)","Produce careful, thorough, accurate work (quality first). Insurance only mitigates losses after the fact.
(Because quality work prevents negligence from occurring. Insurance can’t stop a lawsuit—it only helps cover losses afterward.)"
card47,"Posting false, damaging statements online about a competitor","Constitutes libel → an actionable tort claim; internet posts are fully enforceable.
Posting false statements online that harm a competitor’s reputation can count as libel, which is a kind of defamation. Because libel is an actionable tort, the harmed person or business may be able to sue for damages. It does not matter that the statements were posted on the internet—online posts can still create legal liability. In short, spreading harmful lies online can lead to real legal consequences.

3) Example

If a business owner falsely posts that a rival sells dangerous products when that is untrue, the rival could claim libel. If the false post causes lost customers, that may support a lawsuit. A court can treat online posts the same as other written defamatory statements. So posting lies online is not protected just because it is on social media.

Constitutes means Counts as or is considered.
“Constitutes libel” means something counts as libel.
"
card48,How does Commercial General Liability (CGL) insurance differ fundamentally from E&O insurance?,"E&O = professional mistakes.

CGL covers standard business operational risks (e.g., bodily injury to third parties, property damage caused by non-professional operations). It does NOT cover professional negligence.

Context: If a professional drops equipment during a site visit causing damage, CGL applies. If their blueprint calculation is wrong causing structural failure, E&O applies."
card49,Network-security question,"Which tool lets me filter incoming & outgoing internet traffic to block unauthorised connections for my team? Firewall software.

Simplified Explanation:

The question is asking which tool can control internet traffic going in and out of a network. This tool helps block unwanted or unsafe connections. It protects a team’s devices from hackers or unknown access. The correct answer is firewall software. A firewall acts like a security guard for your network.

Example:

Imagine a school network where students and teachers use the internet. A firewall checks every connection request. If a suspicious website tries to connect, the firewall blocks it. If a trusted app needs access, it allows it. This keeps the network safe and secure."
card50,Whistle-blowing grounds - trade-secret scenario,A geoscientist discovers that management is merely keeping company trade secrets confidential. Does that justify whistle-blowing? No.
card51,Officer starts a rival side-business,Whose interests must come first under fiduciary duty? The company's interests rank ahead of the officer's personal interests.
card52,Hiring a close relative with municipal grant money,Identify the conflicting interests and decide which one (the public's) must take precedence before acting.
card53,Duty to consult and accommodate Indigenous peoples,Who carries the Supreme-Court-mandated duty? The government (Crown) — even when the claim has not yet been proven.
card54,Tendering law (Ron Engineering): what is Contract A?,A bidding contract formed with every compliant bidder once their tender is submitted.
card55,Legal doctrine that says land-sale agreements must be in writing,"Statute of Frauds.

The Statute of Frauds is a rule that says agreements to sell land must be written down to be legally valid. You can’t just rely on verbal promises when it comes to selling or buying land. If it’s not in writing, the deal usually won’t hold up in court. This protects people from fraud or confusion. It’s a way to make land deals clear and official.

Example:

Mark tells Lisa he’ll sell her a piece of land for $50,000, and she agrees—but they don’t write anything down. Later, Mark changes his mind. Because there’s no written contract, Lisa probably can’t force the sale. If they had written and signed an agreement, the Statute of Frauds would make it enforceable."
card56,"Per the Engineers Canada Code of Ethics, what specific mandate must a professional engineer provide for their engineering subordinates?","Opportunities for their professional development.
Mentorship is not just encouraged; it is an active ethical obligation for P.Engs managing unlicensed personnel or EITs."
card57,Insurance nickname that protects professionals,Errors & Omissions (E&O) insurance.
card58,2004 amendment that made workplace-safety violations potentially a criminal offence,"The Criminal Code was amended to impose criminal liability on those who direct work but fail to protect workers/public.

Simplified Explanation:

In 2004, the law was changed so that bosses and managers could be treated as committing a crime if they don’t keep people safe at work. Before this, safety failures were mostly handled with fines or penalties, not criminal charges. After the change, people in charge can be held personally responsible if their actions (or lack of action) put workers or the public in danger. This means safety is taken much more seriously. The law is meant to make workplaces safer. It pushes leaders to actively protect everyone.

Example:

Imagine a construction manager who ignores broken safety equipment. A worker gets seriously hurt because of it. Before 2004, the company might just pay a fine. After the amendment, the manager could be charged with a crime. This could lead to court or even jail time. It makes managers think twice about ignoring safety rules."
card59,Which of these is not a universal level of environmental regulation?,"The Canada National Parks Act (it's federal only; EAs, offences & emissions rules exist at all levels)."
card60,Post-2020 trade pact replacing NAFTA & its effect on engineering credentials,CUSMA (formerly NAFTA); regulators may recognize foreign qualifications but are not obliged to.
card61,"What is the technical term for the legal process required to convert a mere ""filed lien claim"" into a binding and enforceable ""charge"" against a property?","When a contractor, supplier, or engineer first files a lien claim against a property, it acts like a temporary placeholder. It exists, but it isn't automatically enforceable. To turn this claim into a solid, legally recognized and permanent ""charge"" that a court can enforce (like forcing a property sale to get paid), you must go through a formal legal process called perfecting the lien. This often involves starting a lawsuit and registering a certificate on the title within strict deadlines.

This Process is called 'perfecting the lien.'

Filed lien claim mean a formal notice saying someone is owed money.
Perfecting the lien mean completing legal steps to make the lien fully valid and enforceable.

Exmaple:
A contractor finishes work but doesn’t get paid, so they file a lien on the property. That filing alone doesn’t guarantee payment. They must then follow legal steps, like starting a court action within a deadline. Once they do this, the lien becomes enforceable. Now, they can use the law to try to recover their money."
card62,"In a negligent misrepresentation lawsuit, what is the strongest defense if the defendant can prove the plaintiff was already committed to their course of action before the misstatement was made?","Lack of causation (no reliance): The professional’s strongest defense is showing Lack of Causation. If the defendant can prove that the plaintiff was already committed to their course of action before the negligent statement was made, then the plaintiff did not actually rely on the statement. Because there was no reliance, the negligent statement did not cause the loss, and the lawsuit fails.
Lack of causation means no clear link between the action and the harm.

Simplified Explanation:

In negligent misrepresentation cases, a strong defence is showing lack of causation. This means the false statement did not actually cause the harm. If the plaintiff would have made the same decision anyway, then they didn’t truly rely on the information. Without that reliance, the claim becomes weak. The key idea is proving the loss would have happened regardless of the misstatement.

Example:

A person is planning to invest in a company no matter what. Someone gives them slightly wrong information, but they invest anyway as planned. Later, they lose money and try to sue. The defence argues the investor was already committed to investing. This means the wrong information didn’t change their decision. Because of that, the court may find no causation."
card63,State the legal principle derived from the case Rylands v Fletcher.,"Strict liability, which means the person who got hurt doesn't need to prove that the person made the mistake were careless. Even without they prove the court will say the person made the mistake is responsible. They don't see what happened, they see the result in such cases.

Injured party need not prove negligence once the non-natural use of land causes escape and damage.
یعنی اگه یکی از زمینش به شکل غیرعادی استفاده کنه و چیزی ازش خارج بشه و به بقیه آسیب بزنه، دیگه لازم نیست طرف مقابل ثابت کنه اون آدم تقصیر کرده—خودِ اتفاق کافی هست.
Simplified Explanation:

This rule means that if someone uses their land in a risky or unusual way and something dangerous escapes, causing harm, they are automatically responsible. The person who was hurt does not need to prove negligence. It’s enough to show that the danger came from that land and caused damage. This is called strict liability, meaning fault doesn’t have to be proven. The law focuses on the risk created, not the person’s care level.

Example:

Imagine someone keeps a large water tank on their property. The tank bursts, and water floods a neighbor’s house. Even if the owner was careful, they are still responsible. The neighbor doesn’t have to prove the owner was careless. It’s enough that the water escaped and caused damage. So, the owner must compensate the neighbor.

Normally (in negligence), they must prove:
👉 “You were careless” (you did something wrong)

But here?
👉 They DON’T need to show you were careless.
That’s why it’s called strict liability:

Not about your behavior
Just about the result

One-line mindset:
👉 Negligence = “You did something wrong”
👉 Strict liability = “Something went wrong, and it’s your responsibility”"
card64,What question does the reasonable person test ask? And for which cases this test is being used?,"Asks 'What would a reasonable person have done in the same circumstances?'

The reasonable person test is used in negligence cases to see if someone acted carefully enough.
It asks, “What would an average, careful person have done in the same situation?”
If the person didn’t act like that, they may be found negligent.

Example

A store owner doesn’t clean up a spilled drink, and a customer slips.
A court asks: Would a reasonable person have cleaned the spill quickly to prevent danger?
If yes, and the owner didn’t, that’s likely negligence.
The test helps decide if someone’s behavior was careless or acceptable."
card65,"Under the principle of joint liability, if multiple defendants are found liable and one goes bankrupt, how much can the solvent defendant be forced to pay?","Simplified Explanation:

If multiple people are responsible for causing harm, the law can make them all equally responsible. If one person can’t pay (bankrupt), the other person who has money might have to pay all the damages. After paying, that person can try to get some money back from the bankrupt one. However, this usually doesn’t work because the bankrupt person has no money. So in reality, the solvent person often pays everything.

Example:

Imagine two drivers cause an accident together.
Both are held responsible for $10,000 in damages.
One driver goes bankrupt and cannot pay anything.
The other driver still has money, so they may be forced to pay the full $10,000.
Later, they try to get half ($5,000) back from the bankrupt driver.
But since that driver has no money, they get nothing back.

The solvent defendant may be forced to pay 100 % of the damages, then seek (often futile) contribution from the defunct party.
Joint liability means when multiple people are legally responsible together for the same harm or debt
Solvent is the one financially able to pay debts."
card66,"Large, controversial projects (e.g., inter-provincial pipeline): likely federal EA review types",Mediation or Panel Review under the Impact Assessment Act/CEAA.
card67,Corporate environmental audit - which benefit is NOT provided?,It does not grant a tax break simply for undertaking the audit.
card68,"Phase III Environmental Site Assessment (ESA): What does it deliver, and what does it NOT repeat?","Delivers: a remediation plan, detailed description of contaminants, and how we’ll check if it worked (with confirmatory sampling). 
Does NOT repeat Phase I historical-title/previous-owner/neighbour information. 
ESA = Environmental Site Assessment. "
card69,Strict-liability environmental offences - weakest due-diligence proof,Merely having a paper policy (with no evidence of implementation/monitoring) rarely satisfies due diligence.
card70,Contract with a mandatory arbitration clause - can a party refuse and litigate instead?,"No. Once signed, parties are bound; the court can even appoint an arbitrator if they cannot agree.

If you sign a contract with a mandatory arbitration clause, you can’t choose to go to court instead. You’ve already agreed to solve disputes through arbitration only. Even if both parties can’t pick an arbitrator, a court will assign one for them. So, once it’s signed, you’re stuck with arbitration. The court won’t let you skip it and sue instead.

Example:

Emma signs a contract to work on a project. It says all disputes must go to arbitration. Later, there's a disagreement, and Emma tries to sue the company in court. The court refuses because of the mandatory arbitration clause. Even if Emma and the company can’t agree on who should arbitrate, the court will pick someone. She must go through arbitration."
card71,"In Alternative Dispute Resolution (ADR), what is “negotiation” and is the outcome enforceable?","Negotiation = direct discussion/compromise between the parties (no third party). If they reach agreement and sign it, it becomes an enforceable contract."
card72,"PIPEDA data-collection principle that is NOT in the Act.

(PIPEDA stands for The Personal Information Protection and Electronic Documents Act)","No rule limiting use to one year; PIPEDA requires purpose identification, consent, access, safeguards, etc., but sets no fixed time-limit.

Simplified Explanation:

PIPEDA does not set a mandatory one-year clock for data deletion. Instead, it uses a flexible rule: organizations can only keep personal information for as long as necessary to fulfill the specific reason they collected it. Once that purpose is met, the data must be securely destroyed or anonymized, whether that takes three months or ten years. The focus is on 'purpose', not a set deadline.
"
card73,"Harris, Pritchard & Rabins ""Golden Rule"" for engineers abroad - which action is not one of the nine ethical guidelines?","""Paternalize local citizens."" Professionals should not impose their own choices on local people."
