id,term,definition
card134,What is the meaning of Unionize?,"Unionize means Workers forming a group (union) to act together.

Simplified Explanation:

When workers unionize, they come together as a group to negotiate with their boss. This group effort is called collective bargaining. It usually happens when workers feel they are not getting fair pay or being treated properly. Instead of speaking alone, they speak as one strong group. This can help them have more power in discussions. It often shows that the employer hasn’t been listening well before.

Example:

Imagine employees at a store think their pay is too low. One person complaining doesn’t change much. So, they all join together to form a union. Now they meet the boss as a group. They ask for better wages and working conditions. Because they are united, the boss is more likely to listen."
card135,Limited Licence,"A technologist/science-diploma holder with focused experience (≥8 yrs, incl. 1 yr in CA & 2 yrs under P.Eng.) qualifies."
card136,Scope of practice vs. scope of responsibility,Discuss your scope of responsibility - the exact tasks & expectations you'll be accountable for.
card137,Unregulated practice safety risks,"Completion itself doesn't threaten safety; lack of ethics, competence, & insurance do."
card138,Owner's perk in construction management,"General-contractor profit is avoided; owner hires trades directly, CM just manages."
card139,"Under most Canadian professional practice Acts, a firm may include the protected title *""Engineer"" or ""Architect"" in its name only if licensed ______________ are (1) ______________ in the firm and* (2) hold a significant ______________/______________ role (e.g., partner or shareholder).",professionals of that discipline · actively involved · ownership · governance
card140,Property insurance would cover damage from fire or ________.,theft 
card141,Possible disciplinary measures include ________ or license cancellation.,suspension
card142,Examples of Tort,"Example: Imagine Alex, an engineer, lies about a bridge's safety to win a contract—this fraud is an intentional tort. If Alex also walks onto a restricted construction site without permission, that's trespass. Later, Alex tells clients that another engineer is incompetent even though it isn't true; that's defamation. Each of these deliberate actions can lead the injured parties to sue Alex for damages under tort law. If Alex had simply mis-calculated a load because of sloppy math, that would be negligence, not an intentional tort."
card143,What event led provinces to pass the first Acts to license professional engineers in Canada?,The Quebec Bridge collapses of 1907 and 1916; provinces responded by passing the first Professional Engineers Acts. 
card144,What does a Letter of Assurance certify and when is it required?,At project end; certifies the building was constructed according to all sealed plans & specifications.
card145,Thorough review before sealing another engineer's work,Review until you can personally accept full professional responsibility.
card146,Ownership requirement for 'Engineers & Architects',Licensed architects must be partners or shareholders as well as engineers.
card147,"Which organization is responsible for accrediting Canadian engineering degree programs? And Which organization is responsible for accrediting Canadian geoscience degree programs?
Accreditation means
تاییدیه رسمی",Engineers Canada and the Canadian Council of Professional Geoscientists (CCPG) accredit these programs.
card148,Significance of wearing an iron (or earth-science) ring,The wearer has taken an oath to uphold high professional and ethical standards.
card149,Treatment of draft or preliminary engineering documents,Do not seal them and clearly label them 'Preliminary / Not for Construction'.
card150,Worker's 'right to participate' under OHS legislation,"Allows serving on workplace health-and-safety committees to improve safety.

Simplified Explanation:

This means workers have the legal right to be involved in workplace safety decisions. They can join safety committees where issues are discussed. These committees help find ways to prevent accidents and hazards. Workers can share their ideas and concerns. This makes the workplace safer for everyone.

Example:

Imagine a factory where workers notice a machine is dangerous. A worker on the safety committee brings this up in a meeting. The group discusses ways to fix the problem. They decide to add safety guards to the machine. Because workers could participate, the issue gets solved. This helps prevent injuries in the future."
card151,Recommended strategy to avoid 'old-method vs new-method' dilemma,Continuing Professional Development (CPD) is the single recommended strategy.
card152,Which code takes precedence if a technical-society code conflicts with a provincial code?,"The provincial/territorial association’s Code of Ethics prevails.

If a national or technical group’s rules disagree with your local (provincial or territorial) ethics rules, you must follow the local code. That’s because the provincial code has legal authority in that region. Even if the technical society is well-known, its rules are secondary. Local rules override the others when they conflict. Always follow the provincial association’s Code of Ethics first.

Example:

Imagine you're an engineer in Alberta and follow both Engineers Canada’s and IEEE’s rules. If IEEE says it’s okay to accept gifts from clients but Alberta’s code says no gifts allowed, you must follow Alberta’s rule. Even though IEEE is a respected technical society, Alberta’s code is the law in your province. So the local rule wins in a conflict."
card153,Site coordinator responsibility on large Alberta construction site,Must protect all workers on site and anyone in the vicinity affected by site hazards.
card154,Difference between 'environmental compliance' and 'sustainability',"Compliance = day-to-day legal minimum; sustainability = long-term strategy.

Environmental compliance is doing the required legal minimum each day to avoid violations.
Sustainability is a bigger, long-term plan to improve environmental and social outcomes.
Compliance = reactive (follow rules); sustainability = proactive (set goals, innovate).
Compliance answers “Are we legal?”; sustainability asks “Are we responsible and future-proof?”
You need compliance now, but sustainability guides the future.

3) Example

A factory installs filters to meet air emission limits — that’s compliance.
It then sets a goal to cut GHG emissions 50% by 2030, invests in renewables, and redesigns packaging — that’s sustainability.
Compliance prevents fines; sustainability earns trust and saves resources.
Compliance is checklists and permits; sustainability is targets and innovation.
Both matter, but they play different roles."
card155,What is a Life-Cycle Analysis (LCA) inventory?,"Judges a project's sustainability by listing all energy & resource inputs and all outputs (products & wastes) to determine the net result (overall environmental impact).

Inventory: a detailed list of items analyzed."
card156,CPD-exemption request routinely accepted by Canadian associations,"Parental leave (temporary exemption, CPD resumes on return)."
card157,What's the difference between enforcement and discipline in engineering regulation?,"Enforcement: Actions taken against non-members (unlicensed individuals) who unlawfully use protected titles or practise without authorization. Ensures only qualified persons offer engineering services.
Discipline: Actions taken against licensed members found guilty of professional misconduct or incompetence. May include fines, practice restrictions, suspension, or revocation of licence."
card158,Not a Canadian achievement,Luna 3 moon-photography probe (it was Soviet).
card159,Professional engineer's rubber stamp identifiers,Province/territory · Licence type · Name of licence holder · Licence number.
card160,What seals are required on a final engineering drawing?,"One professional seal for each discipline involved (e.g., structural, electrical) + the approving engineer's seal.Discipline: area of expertise (e.g., civil, mechanical)."
card161,Self-regulating profession in Canadian law,A provincial/territorial Act creates an association that regulates the profession itself.
card162,Ethical theories,"Mill's utilitarianism, Kant's formalism, Locke's rights ethics, Aristotle's virtue ethics."
card163,Duty that outranks all others,Duty to protect the public.
card164,What is the key lesson from the Elliot Lake mall collapse?,It highlights human error and a failure of the engineer's duty to society (public safety).
card165,Professional decisions according to the Charter,Independent of religious influence (state neutrality).
card166,Copying unregistered software in Canada,Copyright is automatic upon creation; registration is optional.
card167,Overlap of law and ethics: What's the relationship?,"All criminal acts are unethical, but not all unethical acts are criminal."
card168,"Under Kant’s formalism, who is exempt from basic moral duties like honesty and fairness?",No one. Duties are universal—every person must act in a correct ethical manner. 
card169,"IP (Intellectual Property) creation under contract. 

In the absence of a contract clause stating otherwise, who is the default legal owner of copyright in a work created by an employee in the course of employment?","Creator: the employee; Owner: the employer/client.

Simplified Explanation:

When someone makes something (IP) as part of a job or contract, they are still the creator because they made it. However, the ownership usually goes to the employer or client who paid for the work. This means the company controls how the creation is used. The creator doesn’t usually get full rights to it. This is a common rule in many work agreements. Always check the contract to be sure.

Example:

A programmer builds an app while working for a company.
The programmer is the creator because they wrote the code.
But the company is the owner because they hired and paid the programmer.
The company can sell or update the app.
The programmer can’t take the app and sell it themselves.
This is because of the contract agreement they signed."
card170,Bridge-design choice and Mill's utilitarianism,Allocate more resources to safety for the greater number of users.
card171,What happens if an engineer obeys all client instructions regardless of public welfare?,They violate their professional duty — public safety must come first.
card172,Breach of duty by taking a side job,Duty of loyalty to the employer (competing with your firm).
card173,Codes of Ethics across Canadian jurisdictions,"Each association writes its own, but core principles remain the same nationwide."
card174,Duty to report,"Report any unsafe, unethical, or illegal activity."
card175,Ownership of client drawings,The client owns them; reuse only with the client's express permission.
card176,Exceptions to client/employer confidentiality,"(1) Required by law, (2) Client/employer gives permission, (3) Public-safety override."
card177,"According to Canadian engineering ethics and contract law, does the professional duty of confidentiality to a client or employer expire simply with the passage of time?","No - time alone is NOT a valid reason to disclose confidential information.

Simplified Explanation:

This means just because time has passed, it does not mean you can share private information. Confidential information must still be protected. There needs to be a real and proper reason to disclose it. Time alone is not enough. Privacy rules still apply even after a long period.

Example:

Imagine a doctor knows a patient’s medical history. Even after many years, the doctor cannot share that information just because time passed. They still need a proper reason or permission. If they share it without a valid reason, it breaks confidentiality. This rule helps protect people’s private information."
card178,Morals vs Ethics,Morals = personal beliefs; Ethics = shared societal principles.
card179,Classic definition of conflict of interest,A situation where a professional has conflicting obligations to different parties.
card180,Which is older: ethical writing or calculus/statistics?,"Ethical writing ≈ 3,000 years old; calculus and statistics date since 17th century."
card181,Branch of philosophy studying reasoning,Logic.
card182,Government system echoing Mill's utilitarian ideal,Democracy.
card183,"In Locke's rights-based ethics, what are the three core rights? ","Life, liberty, and property."
card184,Choosing in ethical deadlock,The one that gives you no personal benefit.
card185,Insider trading,Buying shares on non-public news of a soon-to-be-signed contract is called insider trading - illegal.
card186,Code-of-Ethics duty,"Overcharging a client breaches the Code-of-Ethics duty to conduct yourself with courtesy, good faith, and fairness."
card187,What is a “secret commission” in professional ethics?,"The Rule: A secret commission is the formal legal term for a bribe or a kickback. 

The Context: As an engineer, you often hold the power to decide which contractors get hired or which materials are purchased for a project. 

The Trap: If a supplier secretly gives you an envelope of cash, a luxury watch, or an all-expenses-paid vacation to sway your decision in their favor, that is a secret commission. It is illegal and unethical because it forces you to make decisions based on personal greed rather than engineering facts and project safety."
card188,Professional competence,A professional's competence must extend to any professional service they undertake (not an entire discipline).
card189,Acceptable advertisement,"An advertisement by a professional is acceptable under the Acts if it is factual, clear, and dignified (medium is irrelevant)."
card190,Moonlighting,"Moonlighting is ethically acceptable if both your daytime employer and the side-job clients are informed of your limitations.
"
card191,Code's duty to colleagues,"The single phrase that captures the Code's duty to colleagues is to act with courtesy and goodwill toward colleagues.


Simplified Explanation:

The main idea is that a code of conduct expects people to treat their coworkers with respect, kindness, and cooperation. Acting with courtesy means being polite and professional. Showing goodwill means helping others and having positive intentions. Together, this means maintaining good relationships at work. The duty to colleagues is basically to behave in a respectful and supportive way.

Example:

A coworker asks for help on a project, and you assist them politely. You listen respectfully during team discussions. You avoid rude behavior and communicate professionally. You support teammates instead of creating conflict. These actions show courtesy and goodwill. That is fulfilling the Code’s duty to colleagues."
card192,True happiness (eudaimonia),"In Aristotle's virtue ethics, true happiness (eudaimonia) is achieved by cultivating virtues and using reason to find the balanced 'golden mean.'

Simplified Explanation:

In Aristotle’s ethics, the golden mean is the middle point between two extremes: excess (too much) and deficiency (too little). A virtue is usually found in that balanced middle. For example, courage is between cowardice (too little bravery) and recklessness (too much boldness). Generosity is between stinginess and wastefulness. The “mean” does not mean the exact same point for everyone—it means the right balance for the situation, found through reason.

Example:

Courage
Too little: Cowardice
Golden mean: Courage
Too much: Recklessness
Confidence
Too little: Shyness
Golden mean: Healthy confidence
Too much: Arrogance

So the golden mean is the virtue that lies between two opposite extremes."
card193,Duty to inform,"Before deviating from an approved design, the duty to inform requires advising the employer of the consequences of the deviation."
card194,Reporting dishonest conduct,Reporting another practitioner's dishonest conduct is viewed as maintaining the honour and integrity of the profession.
card195,Exceptions for disclosure,"The three standard exceptions that allow disclosure of client/employer confidential info are legal requirement, client/employer permission, or necessary to protect public safety."
card196,Sale of Goods Act,"The Sale of Goods Act implies three conditions that every product must satisfy: 1) Usability / fitness-for-purpose 2) Safety 3) Quality.

The Sale of Goods Act is a law that says all sold products must meet three basic standards: they must work properly (fit for their purpose), be safe to use, and be of good quality. Even if these rules aren’t written in a contract, they still apply automatically. If a product fails one of these, the buyer can ask for a refund or replacement. These protections are built into the sale by default.

Example:

Sara buys a kettle that doesn’t boil water, overheats, and breaks in two days. Under the Sale of Goods Act, she can return it. The kettle isn’t fit for purpose, isn’t safe, and lacks quality. Even if the store didn’t mention these rules, the law still protects Sara. She's entitled to a refund or new product."
card197,Mill's Utilitarianism,Selecting the option that brings the greatest good to the greatest number embodies Mill's Utilitarianism.
card198,Finality vs. interpretation,"In codes & standards practice, 'finality' is the state a document reaches after the professional has applied all relevant codes & standards and it is ready for others to act on; 'interpretation' is the professional judgement used to select, understand, and apply those codes & standards correctly."
card199,Improving communication skills,The best way for a professional to improve poor communication skills is to pursue targeted Continuing Professional Development (CPD) activities.
card200,Whistle-blowing report,"If internal efforts fail and unsafe or illegal practice persists, a Canadian engineer should report to their provincial/territorial regulating body (engineering association)."
card201,Sealing documents,"Only final, completed documents may be sealed; drafts/preliminary prints are never sealed."
card202,Courtroom question on software,The key courtroom question when design relied on commercial software that later failed is: 'What tests did you perform to verify the software output was correct?'
card203,Builders' (all-risk) insurance,"Covers property or structure under construction (materials, labour & partially completed work)."
card204,Duty-to-inform,"Before deviating from an approved design, a P.Eng. must tell the employer the consequences of the deviation on safety, cost, schedule, codes, etc."
card205,Fukushima 2011 sequence,Correct order: (1) Earthquake → (2) Automatic reactor shut-off → (3) Tsunami floods plant → (4) Nuclear meltdown.
card206,What critical PREVENTIVE lesson did the engineering industry learn from the 1982 Lodgepole (Alberta) blowout?,"

The blowout taught that the single most critical prevention measure is rigid adherence to safe, standardized drilling and kick-control procedures.

The core engineering principle here is that standardization is not just bureaucratic; it is a vital safety barrier. A blowout (like Lodgepole) results when standardized preventative barriers fail. Standardizing HOW safe work is performed ensures that a minimum safety standard is maintained at all times, making complex sites more reliable."
card207,Certified Engineering Technologist (C.E.T.),"Only those who voluntarily complete provincial certification may call themselves this; right-to-practice is open to diploma holders, but right-to-title is protected.

Example:

Two people both finish an engineering technology diploma.
One of them applies for and completes provincial certification and becomes a C.E.T.
The other does not apply for certification but still works in engineering jobs.
Both can do similar technical work in the industry.
However, only the certified person can legally use “C.E.T.” after their name.
This protects the professional title from being used without approval."
card208,Ownership of software created by an employee,"The employer owns it (copyright vests in employer, not the individual developer)."
card209,What is the main purpose of a Communications-System Policy (CSP)?,"Main purpose is to educate staff on risks/liabilities of digital communications (e.g., email, chat apps) & set acceptable-use rules for email, IM, etc.

A Communications-System Policy (CSP) tells staff how to safely and properly use work tools like email and messaging.
It teaches them about risks (like data leaks or lawsuits) and sets clear rules for what’s allowed.
The goal is to protect both the company and the employees.

Example

An employee sends a personal joke to a coworker over work email.
The CSP says email should only be used for business purposes.
It also warns that messages can be monitored and might be used in legal cases.
Because of the policy, the employee now knows to keep personal chats off work systems.
This prevents issues for them and the company."
card210,Company name requirements,"Must include ""Ltd./Inc./Corp."" to signal to outsiders that liability is limited to corporate assets."
card211,Software-development failure modes,Technical failure (can't meet spec) and Service failure (system doesn't deliver required function) most threaten public safety.
card212,Liability when design relied solely on software output,P.Eng. remains fully liable; must rigorously check outputs - responsibility cannot be delegated to the program.
card213,Unlicensed person offering structural-design software & support in Alberta,"Selling software is OK, but providing engineering design/consulting services requires a licence/permit."
card214,Whistle-blowing anonymity rule for Canadian P.Eng./P.Geo.,Must identify themselves and be ready to participate; regulator keeps identity confidential only as far as case allows - no fully anonymous reports.
card215,Whistle-blowing channel required by Canadian engineering Codes of Ethics,"Report unethical/unsafe conduct to the applicable provincial/territorial regulator, not to the media."
card216,Client insists on ignoring engineer's structural-safety recommendation - engineer's correct response,Explain the risks in plain language and withdraw from the work; do not assist or supervise unsafe construction.
card217,Professional liability (E&O) insurance in Canada: where & for whom is it most critical?,"Mandatory only in some provinces and especially essential for practitioners in private practice, who have the highest lawsuit exposure."
card218,"In a Due-Diligence defense, which of these four factors is NOT legally considered?
(Foreseeability, Preventability, Controllability, Correctability)","Answer: CORRECTABILITY.

The Rule: Courts only care about what you did BEFORE the incident to stop it. Due diligence relies entirely on whether you could Foresee, Prevent, or Control the hazard.

The Trap: Fixing the mess after someone gets hurt (Correctability) might lower your fine, but it is not a valid due-diligence defense. Sweeping up the broken glass does not prove you took steps to prevent the window from breaking in the first place."
card219,Purpose of a Failure Modes & Effects Analysis (FMEA),"Systematically list each component/assembly, identify how it can fail, and trace the effect of that failure on the larger system."
card220,Scope of a designer's hazard analysis — what uses must be considered?,"Normal use, foreseeable misuse, and failures - all potential hazards must be addressed.

Simplified Explanation:

This means that when a designer checks for safety, they must think about every possible way a product could be used. This includes normal use, but also mistakes people might make (even if they shouldn’t), and things that could go wrong like failures. The goal is to find any danger or risk that could happen. Designers can’t just assume people will use things perfectly. They must plan for real-world behavior. In short, they need to make the product as safe as possible in all situations.

Example:

Imagine designing a kitchen blender. You expect people to use it normally to blend food. But someone might forget to put the lid on, which is foreseeable misuse. The blender could also malfunction and overheat, which is a failure. A designer must think about all these situations. So they might add a safety lock or auto shut-off feature to prevent harm."
card221,"When a design hazard (e.g., exposed blade) is essential and cannot be removed, professional obligation?",Warn users and provide effective shielding/guards to protect public safety.
card222,Three classic grounds for a product-liability lawsuit,1. Defective manufacture 2. Negligent design 3. Failure to warn of inherent dangers.
card223,Difference in focus: building codes vs standards,Codes prescribe how to construct/install; standards set minimum quality & uniformity requirements.
card224,"Professional duty when industry codes are ""very low"" or outdated",Exceed the minimum; engineer must raise the level of care to ensure reliability & safety.
