id,term,definition
card310,Duty of every worker under Occupational Health & Safety Acts,To take reasonable care to protect the health and safety of co-workers and anyone nearby while the worker is working.
card311,Trade-name vs. trademark,A trade name is only a provincial business registration.
card312,What is mediator confidentiality in dispute resolution?,"Definition: All communications (written or spoken) shared with the mediator during a mediation are legally privileged, meaning they cannot be disclosed or used later in arbitration or court.
Key term: Privileged - protected by law from being revealed as evidence.
Example: In private caucus, Company A admits it overlooked a safety risk. That admission stays in mediation and can't be brought into a later lawsuit."
card313,What is the meaning of 10% bid bond?,"Guarantees that the winning bidder will enter into the contract and supply performance security; if the bidder backs out, the surety pays the owner up to the bond amount (typically 10% of the bid).

Simplified Explanation:

A 10% bid bond is like a financial promise that a company is serious about a job they are trying to win. It ensures that if the company wins the contract, they will actually follow through and provide extra guarantees to do the work. If they win but then refuse to start the job, the surety (guarantee company) pays the project owner some money. That payment can be up to 10% of the bid amount. It protects the project owner from losing time and money if the bidder backs out.

Example:

A construction company bids $1,000,000 to build a school.
They include a 10% bid bond, which equals $100,000.
If they win the contract but decide not to do the job, the surety steps in.
The surety pays the school district up to $100,000 as compensation.
This helps the school district cover delays or find another contractor."
card314,TN entry for Canadian engineer,Proof of Canadian or Mexican citizenship + a letter or contract describing the professional purpose of entry.
card315,What is Governing-law clause?,"Definition: A governing-law clause is a part of a contract that tells which state or country's laws will be used to decide any arguments about the deal. It helps everyone know in advance where to go and what rules to follow if they disagree. By choosing a specific jurisdiction, the parties reduce surprises and legal costs. This clause appears near the end of most agreements. It's especially important in deals crossing borders.
Key term: Jurisdiction → the legal authority or region whose courts and laws apply.
Example: ""Imagine two companies—one in California and one in Germany—signing a sales contract. They include a governing-law clause saying California law will apply. Later, they disagree over payment terms. Both sides then know they must ask a California court to interpret the contract. This saves time debating which country's rules to use. It makes the legal process clearer and faster.""
Persian (Farsi): BANDE GHANOON-E HAKEM!"
card316,Forum/venue clause,"States which courts will hear any dispute in multi-country deals.

Phrase	and their Simple Meanings:
Forum/venue clause means A contract term that says where legal disputes will be handled.
Dispute	means A disagreement or legal conflict.
Multi-country deals means Agreements involving parties from different countries.
Courts means The legal system/judges that decide cases.

Simplified Explanation:
A forum/venue clause is a part of a contract that chooses which court or which country’s courts will handle disagreements. This is important in international deals, where companies may be in different countries. It helps avoid confusion about where a lawsuit should be filed. It can also reduce legal fights over jurisdiction. In short, it sets the location for resolving disputes.

Example:
A U.S. company and a German company sign a contract. The contract says any dispute must be heard in New York courts. If a disagreement happens, both sides must go there. They cannot argue later about using German courts instead. That is how a forum/venue clause works."
card317,What is a no-damages-for-delay clause in a construction contract?,"Blocks a contractor from claiming extra ""damages"" (compensation) for delays they cause, but doesn't stop claims if the owner orders a shutdown.

• Example: If a crew miss-schedule causes a week's delay, the contractor gets no extra pay. But if the owner suspends work for permits, the contractor can recover added costs.

Simplified Explanation:

A no-damages-for-delay clause means a contractor usually cannot ask for extra money when delays happen, even if the delay increases costs. It protects the owner from paying for many delay-related claims. If the delay is caused by the contractor’s own scheduling problems, they usually absorb those losses. However, this clause often may not apply when the owner causes the delay, such as ordering a work shutdown. In that case, the contractor may be able to claim extra costs. The exact result depends on the contract wording and local law.

Example:

A contractor plans to pour concrete on Monday, but poor scheduling delays the crew a week. Because of a no-damages-for-delay clause, the contractor may not get extra pay for that delay. But if the owner stops work while waiting for permits, the contractor may seek payment for added labor or equipment costs. In short, contractor-caused delays often are not compensated, while owner-caused delays may be treated differently."
card318,"What is a Per-Diem contract rate, and when is it the best choice to use?","Definition: A fixed, flat daily fee paid to a consultant (""per day"").

When to use it: When the project scope or schedule is unpredictable. It provides daily cost certainty without needing exact hourly estimates.

Example: Paying a site inspector $800/day. You pay the same flat rate whether they actively inspect for 4 hours or troubleshoot for 10 hours that day."
card319,What is quantum meruit and when can you use it?,"Definition: Latin for ""as much as deserved."" Allows you to recover a reasonable value for services and materials when no formal contract exists but the work was accepted.
Example: You clear a flooded basement in an emergency without a contract; the homeowner benefits and refuses to pay—so you sue on quantum meruit to get paid fairly."
card320,Occupational Health & Safety Act,"Employers must provide — and workers must help maintain — a safe, healthy workplace."
card321,What is the standard term of copyright protection in Canada?,Copyright lasts for the life of the creator plus 70 years.
card322,Human Rights Code,"Statute that bans hiring discrimination based on disability (or age, religion, etc.)."
card323,"Loser-Pays Cost Rule-What is it, and why does it matter?","▪️ Definition: A rule in many legal systems where the party that loses a lawsuit must pay a portion (or all) of the winning party's legal costs.
▪️ Purpose: Deters frivolous or weak claims by adding a financial consequence for the loser.
▪️ Example:Acme Corp sues Beta Ltd over a minor contract ambiguity. The court finds in Beta's favor and orders Acme to pay Beta's legal fees. Acme thinks twice before filing similar baseless suits in the future."
card324,Workers'-comp premiums,"Calculated per employee and adjusted for the risk level of the employer's industry.

Simplified Explanation:

This means that a company pays insurance costs for each employee. The amount depends on how many workers there are and how risky their jobs are. If the job is more dangerous, the company pays more money. If it’s safer, they pay less. The type of industry (like construction vs. office work) affects the price.

Example:

A construction company has workers who use heavy machines and work at heights. Because this job is riskier, their insurance cost per worker is higher. An office company has employees who sit at desks most of the day. Since this job is safer, their insurance cost is lower. So, the total cost depends on both the number of workers and how risky their jobs are."
card325,Arbitration in construction contracts,"Construction contracts often use arbitration instead of court because it is generally faster, cheaper, and private compared with litigation."
card326,Entering the U.S. as a Canadian engineer under CUSMA/USMCA,Proof of Canadian citizenship + a letter or contract stating the professional purpose (TN category).
card327,What is a change order?,"A change order is basically a small written update to the contract when something changes during the project.
Think of it as a receipt that says:

how much extra work is being added

or how much work is being removed (a credit)

and what the new total contract price becomes.

It’s simple, but important. Without a change order, arguments explode later about “who agreed to what.”
So it acts like a financial bookmark that keeps everyone honest.

Analogy:
Imagine you’re at a barbershop.
You ask for a haircut ($30), but halfway through you say, “Can you also trim my beard?” The barber says, “That’s $10 extra.”
A change order is the written note that says:
“Haircut $30 + Beard trim $10 = $40 total.”
No surprises. No fights."
card328,Key difference: Québec Civil Code vs. Common-law courts,Civil Code puts less weight on case precedent; Common Law relies on it heavily.
card329,Five things that make a contract enforceable,"Offer/acceptance, mutual intent, consideration, capacity, and a lawful purpose (the deal itself can't be illegal)."
card330,Legal systems used in Canada,Common law (everywhere except Québec) and Civil law (Québec).
card331,"What's the golden rule for expert witness testimony?
(Expert witness = a specialist who gives opinion evidence in court)","Only offer opinions on matters within your documented expertise.

• E.g., a geotechnical engineer shouldn't testify on electrical circuitry."
card332,CCDC 2,"A standard Canadian fixed-price construction contract form issued by the Canadian Construction Documents Committee.

Example: A municipality uses CCDC 2 to award a $5 million bid for its new library, locking in the price and scope agreed in the contract."
card333,What is a material mistake in contract law?,"A material mistake is a significant error about a fact central to the contract that existed when the agreement was made, allowing the mistaken party to void the contract.

Example: Alice buys what she believes is an original painting. After signing, she learns it's a cheap replica. Because authenticity was essential, she can cancel the deal.

Difficult word:
Voidable - able to be legally canceled or undone by one party."
card334,Doctrine of Estoppel-What stops a party from enforcing strict contract terms after they've let the other side ignore them?,"A legal rule that prevents someone from insisting on a strict contract right if they previously waived it or led the other side to believe they would be lenient.

Example: A landlord accepts late rent for months without penalty. Later, they cannot suddenly enforce a late‐fee for those same missed due dates.

Difficult word:Waive - to voluntarily give up a right."
card335,"In Canada, what type of automatically acquired trademark right requires no official registration, application fees, or government approval, relying solely on established public use and a recognized business reputation in a specific area?","A Common-law Trademark Right. It is the most affordable way to secure basic protection for a business name, established through consistent public use in a defined geographical area.

Simplified Explanation:

Common-law trademark rights mean you can get some legal protection for a business name just by using it in real life, even if you don’t officially register it. If you use a name consistently and publicly, you may gain rights to it in your area. This is often the cheapest way to protect a business name in Canada. However, the protection is usually stronger if you register it officially. It depends on how well-known and widely used the name is.

Example:

A person starts a bakery called “Sunny Bakes” and uses that name in ads, signs, and sales across several cities. Over time, people recognize the name as theirs. Even without registration, they may gain common-law trademark rights. If another bakery nearby tries to use the same name, they may be able to challenge it. However, their protection is stronger if they officially register the trademark."
card336,Duration of Canadian copyright after creator's death,Life of the author plus 70 years.
card337,Goal of arbitration versus court on construction jobs,"Generally cheaper, faster, and private compared with litigation."
card338,What are the five essential elements required for a contract to be legally enforceable in Canada?,"O A M C L → Offer/Acceptance, Mutual intent, Consideration, Capacity, Lawful purpose.

The five elements are: Offer and Acceptance, Mutual Intent to be bound, Consideration (something of value exchanged), Capacity (parties' legal ability to contract), and Lawful Purpose (legal objective).Example: A P.Eng. offers to design a bridge, the client accepts, both intend to be bound, payment is agreed, both are competent, and the purpose is legal. (Syllabus topic I.3, Law text p.12 or p.18)"
card339,"After a formal discipline hearing finds a member guilty, who issues the order of discipline?","The Discipline Committee issues the order of discipline (e.g., fine, suspension, terms). "
card340,Discipline vs. Enforcement,"The association charges a member with incompetence or breaching the Code of Ethics, then holds a hearing."
card341,Discipline order effect,The discipline order takes effect immediately; no formal hearing is held if the investigated engineer admits misconduct and accepts the proposed penalty.
card342,What is the typical order of a Practice Review Board (PRB) check?,(1) Review the firm’s written practice/quality procedures → (2) meet/interview key staff → (3) issue a report with findings & recommendations.
card343,The Primary Purpose of a Firm Practice Review ,"Core Objective: To verify that the engineering firm has implemented and actively follows an adequate ""practice plan.""

Key Tasks:
- Flag risks or gaps in the firm's quality management and ethical practices.
- Ensure compliance with professional standards and regulations.

*What it is NOT*: A practice review is NOT an audit of financial status, profitability, or overall business performance."
card344,How does the Practice Review Board (PRB) verify the honesty and accuracy of members' self-reported CPD records each year?,"Each year, the Practice Review Board (PRB) audits (officially checks) a random sample of submitted Continuing Professional Development (CPD) records to verify their accuracy and honesty."
card345,Engineers Canada's reason for CPD in one word,"Maintains competence, a core duty in every Code of Ethics."
card346,"If two parties to an arbitration can't agree on a single arbitrator, how is the arbitrator chosen?","Either party may ask the court to appoint the arbitrator.

Arbitrator: a neutral third party who resolves the dispute."
card347,Arbitration appointment for low-quality fabric dispute,"A court can appoint the arbitrator upon request if parties picked arbitration but can't agree on an arbitrator.

Simplified Explanation:

If two people agree to solve a problem using arbitration but can’t decide who the arbitrator should be, they can ask a court for help. The court can then choose the arbitrator for them. This usually happens when both sides are stuck and cannot agree. It helps keep the process moving forward. The court does not solve the dispute itself—it only helps pick the person who will.

Example:

Imagine two clothing companies are arguing about low-quality fabric. They agreed earlier to use arbitration instead of going to court. But now, they can’t agree on who should be the arbitrator. One company asks the court for help. The court then appoints an arbitrator. That arbitrator listens to both sides and makes a final decision."
card348,Mandatory CPD Programs - What are they and who must do them?,"Continuing Professional Development (CPD) programs mandate ongoing learning (courses, workshops, etc.) to maintain professional competence. They're now required not just for engineers, but also for doctors, lawyers, accountants and others—both across Canada and around the world.

Example: An Ontario engineer must log ≥30 CPD hours/year to renew their P.Eng.; a UK physician must complete 50 CPD credits annually."
card349,Personal benefit of keeping up CPD hours,Better chance of promotions or pay-raises - you're more valuable to employers.
card350,Reviewer action after failing a practice review,Recommend the member be disciplined (discipline = official penalties from the regulator).
card351,Incompetence,Lack of adequate skill or care.
card352,PRB (Practice Review Board),"A committee of experienced professionals appointed by the association to audit members' competence and Continuing Professional Development (CPD) records, ensuring they meet practice standards."
card353,CPD records audit,"To check self-reports are fair and honest - i.e., truthful and complete."
card354,Certificate of Authorization / Permit to Practise,Allows the firm to practise engineering / geoscience through employees who are P.Eng./P.Geo. licence-holders.
card355,Trigger not used for Association individual Practice Review,"""Being internationally educated."""
card356,Public access to Discipline-Committee hearings,"Generally open to the public, closed only if security / confidential matters are involved."
card357,Main reason associations audit members' CPD logs,To verify self-reported hours are fair & honest (truthful).
card358,Appeal after Practice Review Board (PRB) Decision,"A member may appeal any PRB decision to the Association's Appeal Board, which will re-examine the finding and can confirm, modify, or overturn it.
Appeal Board (a short definition): a committee that reviews and changes (if needed) decisions made by the PRB."
card359,Committee membership restriction: Can you serve on both the Investigation (Complaints) Committee and the Discipline Committee?(Investigation Committee - gathers and reviews complaints; Discipline Committee - holds formal hearings),"No - you may join only one committee at a time, ensuring the investigative and disciplinary stages stay independent and impartial.

You can’t be on both the Investigation and Discipline Committees at the same time.
This rule helps make sure that fact-finding and decision-making stay separate.
The idea is to keep the process fair, with no one person influencing both steps.
You must choose one role—either help investigate or help decide punishment.
It avoids conflict of interest and keeps everything neutral.

Example:

Imagine you're part of a school panel.
If you help gather facts about a cheating case, you shouldn’t also decide the punishment.
Why? Because you might be biased from already seeing the evidence.
So, one group checks the facts, and another group decides what to do.
That’s why you can only join one committee—it keeps things honest and fair.
This way, no one has too much power in the process."
card360,Association's power against unlicensed person,"Starts an Enforcement process against the non-member (not Discipline, which is only for members)."
card361,Possible money consequences after misconduct,"Member may have to pay the hearing costs and a fine (up to ~$5-15 k, varies by province)."
card362,Personal benefit of CPD,Better chance of promotions / pay raises - you become more valuable.
card363,Three federal environmental statutes,"Canadian Environmental Protection Act (CEPA), Fisheries Act, Canadian Environmental Assessment Act (CEAA)."
card364,"What is the purpose of PIPEDA in Canada, and who does it apply to?

PIPEDA (Personal Information Protection and Electronic Documents Act)","PIPEDA (Personal Information Protection and Electronic Documents Act) governs how private-sector organizations collect, use, and disclose personal information in Canada, ensuring privacy protection.

Example: An engineering firm must obtain client consent before sharing their personal data with a third party for project purposes. (Syllabus topic I.3, Law text p.12 or p.18)"
card365,Legally enforceable part of a patent,"The Claims section - it defines the protected features of the invention.

The claims section of a patent is the only part that’s legally protected. It lists the specific features of the invention that others can’t copy. If someone breaks those rules, the inventor can sue them. Other parts of the patent explain things, but only the claims can be enforced in court.

Example:

An inventor patents a new type of water filter. The patent has drawings and descriptions, but the claims section says, “a filter with a triple-layer mesh and a carbon core.” If someone else makes a filter with that same setup, the inventor can take legal action. Only what's in the claims is legally protected.

Alex invents a new type of phone charger and gets a patent. In the Claims section, he describes the exact design and how it works. Another company copies his design. Because it’s covered in his patent claims, Alex can sue them for infringement. The claims define his legal rights."
card366,What triggers the requirement for a prime contractor under Canadian Occupational Health and Safety (OHS) regulations for a construction project?,"The requirement for a prime contractor is triggered when two or more employers work simultaneously at a construction site. The prime contractor, designated in the contract, coordinates and ensures the safety of employees and the public. If not specified, the owner assumes this role.

Example: A site with a plumbing and framing contractor requires a prime contractor to manage safety, like ensuring fall protection. (Syllabus topic I.2, Ethics 5th ed. p.146 or 6th ed. p.145)"
card367,"In the context of Occupational Health and Safety (OH&S) legislation, what is the precise definition of an ""occupational disease"" or ""occupational illness""?","A disease or serious ill-health condition that has a proven and direct causal link to an individual's specific job duties or exposure to specific hazards within their workplace.

Simplified Explanation:

An occupational disease (or illness) is a health problem that is caused by a person’s job or workplace. It happens because of conditions at work, not random or unrelated causes. The illness must be directly linked to the work being done. These rules are set out in occupational health and safety laws. The key idea is that the job itself is what leads to the sickness.

Example:

A factory worker breathes in harmful dust every day at work. Over time, they develop a lung disease. Doctors confirm it is caused by the workplace environment. Since the illness is directly linked to the job, it is considered an occupational disease."
card368,Main goal of WHMIS,Give trained workers clear information (labels + SDS) when handling hazardous materials.
card369,Unprofessional conduct example,Leading others to believe you're still registered when you're not.
card370,Cross-licensing,lets both patentees use each other's inventions legally when one patents an improvement to the other's invention.
card371,Consideration,Any amendment must be backed by new consideration (something of value exchanged).
card372,What is a tort?,"A civil wrong where someone’s actions (or carelessness) cause harm to another person, and the injured person can sue for compensation instead of criminal punishment.

A tort happens when one person hurts another person or their property, even if it wasn’t on purpose.
It’s not a crime, so no one goes to jail — but the injured person can sue for money to make up for their loss.
Torts cover things like accidents (negligence), defamation, or trespassing.
It’s part of civil law, not criminal law.
In short: a tort means “you hurt me — now fix it with money.”"
card373,What is a letter of intent (LOI)?,"short note showing intent to sign a full contract later.

A letter of intent is like saying, “I’m serious about this deal, but we’re not signing the final contract yet.”
It shows someone’s interest and commitment, but without all the final details locked in.
It’s often used in business, jobs, or big projects to start things off.
Think of it like a promise to keep talking and move forward.
It’s not legally binding (usually), but it shows you’re not just window-shopping.
It helps get everyone on the same page before the real contract."
card374,Moral rights,"personal, non-economic creator rights; right to be credited & to protect the work's integrity."
card375,Industrial-design application,"needs name, fee, drawings; a descriptive statement of unique features is optional."
card376,Expert witness,Help judge/jury understand technical issues and add credibility (expert opinion is admissible).
card377,Movable tangible personal property,Chattels.
card378,"What is a fundamental breach, and what can the innocent party do?",A fundamental breach goes to the root of the contract and denies most/all benefits; the innocent party may treat the contract as terminated and sue for damages. 
card379,Usual split of content in Canadian Acts & Regulations,Act = purpose & principles; Regulation = detailed rules for applying the Act.
card380,Disability-based discrimination,Can be allowed if the job genuinely cannot be done with the disability (a 'bona fide occupational requirement').
card381,Why 'gelato' is un-registrable as a Canadian trademark,It's a descriptive foreign word for the goods themselves; such marks are refused.
card382,Obligations in a performance bond,Primary obligations / Secondary obligations.
